{
  "$schema": "https://json-schema.org/draft/2020-12/schema",
  "$id": "https://write-on-mars.dev/contracts/manifest/v1.0.json",
  "title": "Write.OnMars Project Manifest v1.0",
  "description": "Manifest declared by every editorial project that uses the Write.OnMars harness. Produced by `writeonmars-install` (FR-001..FR-004) and updated when versions, signing matrix or operators change.",
  "type": "object",
  "required": [
    "framework_version",
    "constitution_version",
    "agent_target",
    "language_primary",
    "skills",
    "research_mode",
    "signing_matrix",
    "human_operators",
    "citation_contract_version"
  ],
  "additionalProperties": false,
  "properties": {
    "framework_version": {
      "type": "string",
      "pattern": "^\\d+\\.\\d+\\.\\d+$",
      "description": "Semver of the Write.OnMars framework installed in this project."
    },
    "constitution_version": {
      "type": "string",
      "pattern": "^\\d+\\.\\d+\\.\\d+$",
      "description": "Semver of the constitution under which the project operates."
    },
    "agent_target": {
      "type": "string",
      "enum": ["claude-code", "codex", "cursor", "other"],
      "description": "Primary agent used to operate the framework. v1 prioritises claude-code."
    },
    "language_primary": {
      "type": "string",
      "pattern": "^[a-z]{2}(-[A-Z]{2})?$",
      "description": "ISO-639 + optional region. Default 'es'."
    },
    "skills": {
      "type": "array",
      "minItems": 1,
      "items": {
        "type": "object",
        "required": ["name", "version", "source"],
        "additionalProperties": false,
        "properties": {
          "name": {"type": "string", "minLength": 1},
          "version": {"type": "string", "pattern": "^\\d+\\.\\d+\\.\\d+$"},
          "source": {"type": "string", "enum": ["bundled", "external"]},
          "path": {"type": "string", "description": "Optional explicit path when symlinked or relocated."}
        }
      },
      "description": "Skills enabled in the project. Bundled = shipped by Write.OnMars (e.g. /marcela-prose, /technical-guide-design, writeonmars-*). External = installed by the operator from another source."
    },
    "research_mode": {
      "type": "string",
      "enum": ["byom", "bundled"],
      "description": "byom = the project relies on external MCPs that comply with the citation contract (default v1). bundled = the project activates writeonmars-research as the canonical research+contrast MCP."
    },
    "signing_matrix": {
      "type": "object",
      "required": [
        "pasada_1_estructura",
        "pasada_2_utilidad",
        "pasada_3_naturalidad",
        "pasada_4_precision",
        "pasada_5_formato"
      ],
      "additionalProperties": false,
      "properties": {
        "pasada_1_estructura": {"$ref": "#/$defs/signingPolicy"},
        "pasada_2_utilidad": {"$ref": "#/$defs/signingPolicy"},
        "pasada_3_naturalidad": {"$ref": "#/$defs/signingPolicy"},
        "pasada_4_precision": {"$ref": "#/$defs/signingPolicy"},
        "pasada_5_formato": {"$ref": "#/$defs/signingPolicy"}
      },
      "description": "Per-pass signing policy. v1 default: pasadas 1, 2, 5 = autonomous; pasadas 3, 4 = human."
    },
    "human_operators": {
      "type": "array",
      "minItems": 1,
      "items": {
        "type": "object",
        "required": ["id", "role"],
        "additionalProperties": false,
        "properties": {
          "id": {"type": "string", "minLength": 1, "description": "Stable identifier used in pass signatures."},
          "email": {"type": "string", "format": "email"},
          "role": {"type": "string", "enum": ["editor", "author", "reviewer", "maintainer"]}
        }
      },
      "description": "Humans authorised to sign passes flagged as 'human' in signing_matrix."
    },
    "citation_contract_version": {
      "type": "string",
      "pattern": "^\\d+\\.\\d+$",
      "description": "Citation contract version this project supports. Records emitted by MCPs are validated against this version."
    },
    "project_type": {
      "type": "string",
      "enum": ["editorial", "software", "mixed"],
      "description": "Optional. Selects the mode of `.specify/templates/*` consumed by Spec Kit. `editorial` activates the brief of nine fields, the temario / descripciones encadenadas, the five-pasada checklist materialisation and the editorial Constitution Check. `software` keeps the classic Spec Kit behaviour. `mixed` renders both. Default behaviour when absent: software."
    },
    "memory_external": {
      "type": "object",
      "additionalProperties": false,
      "description": "Optional vector memory configuration. Cache only; never source of truth (constitution § Arquitectura del framework).",
      "properties": {
        "enabled": {"type": "boolean", "default": false},
        "provider": {"type": "string"},
        "uri": {"type": "string"},
        "rebuildable_from_repo": {"type": "boolean", "const": true}
      }
    },
    "writeonmars_research_module": {
      "type": "object",
      "additionalProperties": false,
      "description": "Optional bundled MCP module activation (FR-009b).",
      "properties": {
        "enabled": {"type": "boolean", "default": false},
        "version": {"type": "string", "pattern": "^\\d+\\.\\d+\\.\\d+$"}
      }
    }
  },
  "$defs": {
    "signingPolicy": {
      "type": "string",
      "enum": ["autonomous", "human"],
      "description": "autonomous = pass closes when checklist is green. human = an operator listed in human_operators must sign."
    }
  }
}
